{
  "schemaVersion": 1,
  "id": "01TEST00000000000000000002",
  "type": "gift",
  "occurredAt": "2026-09-06T00:00:01.000Z",
  "receivedAt": "2026-09-06T00:00:01.050Z",
  "source": { "bridge": "synthetic" },
  "user": { "id": "1002", "handle": "lucas", "nickname": "Lucas" },
  "payload": {
    "giftId": "5827",
    "giftName": "Perfume",
    "coins": 20,
    "repeat": 1,
    "comboFinished": true
  }
}
