{
  "schemaVersion": 1,
  "id": "01TEST00000000000000000001",
  "type": "gift",
  "occurredAt": "2026-09-06T00:00:00.000Z",
  "receivedAt": "2026-09-06T00:00:00.050Z",
  "source": { "bridge": "synthetic" },
  "user": { "id": "1001", "handle": "ana", "nickname": "Ana" },
  "payload": {
    "giftId": "5655",
    "giftName": "Rose",
    "coins": 1,
    "repeat": 1,
    "comboFinished": true
  }
}
